<?xml version="1.0" encoding="utf-8" ?>
<xs:schema xmlns:xs="http://www.w3.org/2001/XMLSchema">
  <xs:element name="users">
    <xs:complexType>
      <xs:sequence>
        <xs:element name="user" minOccurs="0" maxOccurs="unbounded">
          <xs:complexType>
            <xs:sequence>
              <xs:element name="userid" type="xs:positiveInteger"/>
              <xs:element name="username" type="xs:string"/>
              <xs:element name="password" type="xs:string"/>
              <xs:element name="email" type="xs:string"/>
              <xs:element name="usertype" type="types"/>
            </xs:sequence>
          </xs:complexType>
        </xs:element>
      </xs:sequence>
    </xs:complexType>
  </xs:element>
  <xs:simpleType name="types">
    <xs:restriction base="xs:string">
      <xs:enumeration value="Admin"/>
      <xs:enumeration value="Client"/>
    </xs:restriction>
  </xs:simpleType>
</xs:schema>